{
  "schemaVersion": 1,
  "appId": "sample-app",
  "goal": "保存设置并确认结果",
  "steps": [
    {
      "id": "save-settings",
      "type": "click",
      "locator": {
        "role": "button",
        "accessibleName": "Save"
      },
      "postconditions": [
        {
          "type": "visible",
          "locator": {
            "text": "Saved"
          }
        }
      ]
    },
    {
      "id": "saved-state",
      "type": "screenshot",
      "options": {
        "label": "saved-state"
      }
    }
  ]
}
